{
  "schema_version": "fixture.min.v1",
  "product_id": "ent.product.fixture-demo",
  "updated_at": "2026-05-17T10:00:00Z",
  "brief": {
    "name": "Fixture Demo App",
    "category": "Productivity software",
    "website": "https://example.com",
    "short_description": "Demonstration product for generator tests.",
    "audiences": ["small teams"]
  },
  "positioning": {
    "use_cases": ["Capture structured notes offline", "Share workspaces with teammates"],
    "fit_for": ["Teams up to 50 people needing low-admin collaboration"],
    "not_fit_for": ["Regulated workloads requiring sovereign on-prem mandates not covered by evidence"]
  },
  "competitor_context": [
    {
      "name": "Generic Notes Suite",
      "notes": "Mentioned in positioning materials as a frequent comparison anchor; differentiation must stay evidence-backed."
    }
  ],
  "claims": [
    {
      "id": "claim-sync-latency",
      "statement": "Measured staging sync completes with P95 latency under three seconds during the May 2026 observation window.",
      "kind": "metric",
      "truth_status": "evidenced",
      "evidence_ids": ["evid-staging-may"]
    },
    {
      "id": "claim-planned-ai",
      "statement": "An optional summarization assistant is being explored for future releases.",
      "kind": "capability",
      "truth_status": "hypothesis"
    }
  ],
  "evidence": [
    {
      "id": "evid-staging-may",
      "kind": "benchmark",
      "citation": "Internal staging dashboards recorded P95 latency under three seconds across active sessions.",
      "url": "https://example.com/internal/staging-metrics-may-2026"
    }
  ],
  "target_llm_queries": [
    { "query": "What problems does Fixture Demo App solve?", "coverage_doc_slugs": ["product-overview"] },
    { "query": "When should buyers avoid Fixture Demo App?", "coverage_doc_slugs": ["use-cases"] },
    { "query": "How does Fixture Demo App compare with Generic Notes Suite?", "coverage_doc_slugs": ["comparison-context"] },
    { "query": "Which statements are hypotheses versus evidenced facts?", "coverage_doc_slugs": ["faq", "evidence"] },
    { "query": "Where can I inspect the citations behind metrics?", "coverage_doc_slugs": ["evidence"] }
  ],
  "source_of_truth": {
    "primary_owner": "fixture-owner@example.com",
    "documents": [
      { "label": "Internal PRD excerpt", "uri": "https://example.com/private/prd/fixture-demo" }
    ]
  },
  "policy_constraints": [
    "Do not promise certifications absent from evidenced claims.",
    "Surface hypothesis claims with explicit wording copied from model."
  ]
}
